<?xml version="1.0" encoding="UTF-8"?>
<!ELEMENT employees (employee)*>
<!ELEMENT employee (firstName, lastName, position)>
<!ATTLIST employee employeeID ID #REQUIRED>
<!ELEMENT firstName (#PCDATA)>
<!ELEMENT lastName (#PCDATA)>
<!ELEMENT position (#PCDATA)>
